{
  "$schema": "http://json-schema.org/draft-07/schema#",
  "type": "object",
  "properties": {
    "Personal Information": {
      "type": "object",
      "properties": {
        "Name": { "type": "string" },
        "Birthdate": { "type": "string" },
        "E-mail": { "type": "string" },
        "Phone": {
          "type": "array",
          "items": { "type": "string" }
        },
        "Current location": { "type": "string" }
      },
      "required": ["Name"]
    },
    "Social": {
      "type": "object",
      "properties": {
        "LinkedIn": { "type": "string" },
        "GitHub": { "type": "string" },
        "Facebook": { "type": "string" },
        "Twitter": { "type": "string" },
        "Instagram": { "type": "string" }
      }
    },
    "Overview": { "type": "string" },
    "Projects": {
      "type": "object",
      "additionalProperties": { "type": "string" }
    },
    "Professional skills": {
      "type": "object",
      "additionalProperties": { "type": "array", "items": { "type": "string" } }
    },
    "Employment history": {
      "type": "object",
      "additionalProperties": {
        "type": "object",
        "properties": {
          "Name": { "type": "string" },
          "Brief": { "type": "string" },
          "Website": { "type": "string" },
          "Period": { "type": "string" },
          "Position": { "type": "string" },
          "Description": { "type": "string" },
          "Projects": {
            "type": "object",
            "additionalProperties": { "type": "string" }
          },
          "Programming languages, products and technologies": { "type": "string" }
        },
        "required": ["Name"]
      }
    },
    "Education": {
      "type": "array",
      "items": {
        "type": "object",
        "properties": {
          "Institution": { "type": "string" },
          "Faculty": { "type": "string" },
          "Graduation": { "type": "integer" },
          "Degree": { "type": "string" },
          "Achievements": { "type": "string" }
        },
        "required": ["Institution", "Graduation"]
      }
    }
  }
}
